{
  "$schema": "https://json-schema.org/draft/2020-12/schema",
  "title": "StyleArchitecture",
  "type": "object",
  "required": [
    "platform",
    "user_preferences",
    "style_theme",
    "main_light_direction",
    "color_strategy",
    "lighting_strategy",
    "lens_strategy",
    "prop_system",
    "background_strategy",
    "text_strategy",
    "global_negative_rules"
  ],
  "properties": {
    "platform": { "type": "string" },
    "user_preferences": { "type": "array", "items": { "type": "string" } },
    "style_theme": { "type": "string" },
    "main_light_direction": { "type": "string" },
    "color_strategy": { "type": "array", "items": { "type": "string" } },
    "lighting_strategy": { "type": "array", "items": { "type": "string" } },
    "lens_strategy": { "type": "array", "items": { "type": "string" } },
    "prop_system": { "type": "array", "items": { "type": "string" } },
    "background_strategy": { "type": "array", "items": { "type": "string" } },
    "text_strategy": { "type": "array", "items": { "type": "string" } },
    "global_negative_rules": { "type": "array", "items": { "type": "string" } }
  },
  "additionalProperties": false
}
